,text,label
936,"Community Hangout 62 starts at 2pm EDT, 11am PDT, 8pm CET. We are discussing tech updates, community updates and our DAO proposal. #scala #etherum #bitcoin #blockchain",compsci
1265,I made a teminal tool that shows the weather in neo-fetch like style!,Python
1425,"decfunc - a library to create decorators in a simple way, using classes",Python
893,"A ""Modern"" Approach",compsci
1377,I've made a matplotlib layout generator. Generate axes code using visual app. I hope you find it useful.,Python
196,"What skills would a ""full stack"" data scientist have?",datascience
218,Topological DA for Network neuroscience and clinical psychology - Material,datascience
456,Beginning Machine Learning with TensorFlow JS,learnmachinelearning
1521,Python turns 30 this month😎,Python
788,Web app that digitizes the chessboard positions in pictures from any angle,learnmachinelearning
1260,You can now use 'pip' to install Tailwind CSS. Node.js is no longer required,Python
493,How to code Obama? a walkthrough,learnmachinelearning
914,16-bit ALU built within Minecraft video game ,compsci
793,Top 10 Cities in the World for the best AI and Machine Learning Jobs,learnmachinelearning
56,An easy guide for choosing visual graphs!!,datascience
920,EARN-IT Act threatens end to end secure encryption by requiring communications technology to install back door for Feds,compsci
502,"Using StyleGANs to recreate faces in historical paintings 🖼 You can clearly observe the depth of clarity, accuracy and precision in the outputs on the right. Truly amazing! More like these can be found on Nathan Shipley’s IG Account: https://lnkd.in/d3BYmUM",learnmachinelearning
1418,pytest-timestamps will add in-line timestamps to your terminal,Python
1199,Proposal for r/python to adopt Python's code of conduct,Python
1509,I made a very useful tool for my school and they are very happy with me!,Python
863,"On popular demand, the Spiral of Theodorus is now back in dark mode!",compsci
582,Online resources that explain while coding,learnmachinelearning
42,I created a complete overview of machine learning concepts seen in 27 data science and machine learning interviews,datascience
1416,CFP and Tickets are now available! | PyCon Italia 2022,Python
648,How to interpret GitHub repositories,learnmachinelearning
604,"Sieve: We processed ~24 hours of security footage in <10 mins, now you can search per-frame!",learnmachinelearning
1309,Is Python Suitable for Mobile Applications?,Python
702,How does ADAM choose the learning rate?,learnmachinelearning
1098,Some of the best Java Multithreading and Concurrency Courses for beginners in 2021,compsci
817,Visualize output of CNN's hidden layers [ output of each layer ] webapp [code below],learnmachinelearning
371,I was curious if this is legit or an exaggerated mess... only done very basic Data Science courses before,datascience
1518,Python has made my job boring,Python
374,What’s the deal with python becoming more popular in job ads?,datascience
568,[P] Comparison Between Player of Games and AlphaZero,learnmachinelearning
494,Variance And Bias Cheatsheet,learnmachinelearning
1103,"Do IT companies actually take care of the algorithmic complexity of their code, or do they just stop at a ""good enough?""",compsci
136,Someone mentioned a YouTube channel dedicated to statistics but I can't for the life of me remember its name,datascience
847,How to Find Korean Actors for Binge-Watching with Machine Learning,learnmachinelearning
1275,Understand operator overloading in Python in just 9 minutes.,Python
210,What academic path should one take in order to learn GPT-3 and everything about natural language processing in higher education?,datascience
97,My Giant Data Quality Checklist,datascience
1546,✔ Python Inheritance OOP For Beginners,Python
364,Does documentation make you hate the job?,datascience
1501,Gamestonk Terminal: The equivalent to an open-source python Bloomberg Terminal.,Python
640,Data science competition recommendations,learnmachinelearning
401,Data science job market shrinking while data engineering is exploding,datascience
1095,Why use a rational database such as MySQL rather than just creating a data structure such as a hash table?,compsci
786,Wondering how learning AI will be integrated into youth education?,learnmachinelearning
1542,Python is too nice,Python
880,Real functional programmer don't need functional languages.,compsci
582,Understanding Forward Propagation in Neural Networks with Python,learnmachinelearning
142,Why learn SQL for ML tasks,datascience
1055,Bank of England unveils new banknote celebrating WW2 code-breaker Turing,compsci
1218,My first ever Python project: A COVID-19 Tracker,Python
813,How to Start Machine Learning in python in 2021 for free & 100% online,learnmachinelearning
568,"Custom .h5 for ""dickpics""",learnmachinelearning
415,Let's make a Simple Voice Assistant like J.A.R.V.I.S using Python [for Beginners & Intermediates],learnmachinelearning
857,More Universities Should Shut Down Their Computer Science Programs,compsci
430,"Identical Twins no longer fool Visual AI! - (BTW: I'm the black dude from 2 weeks ago whose AI kept classifying as Obama lol 😅). I gotta say, I'm pretty happy with this progress! ^__^",learnmachinelearning
1525,Datasette Desktop 0.2.0: The annotated release notes,Python
883,Less math intensive Computer Science research area,compsci
1218,Wrote a script that downloads r/wallpaper's hottest 100 images and cycles through them as a wallpaper!,Python
1484,"I made my first ""complicated"" program, and I'm pretty proud of it!",Python
68,R for Data Science,datascience
1329,Exploratory Data Analysis in Python,Python
1524,8 Different ways to flatten a list of lists in Python,Python
728,Any references in image data collection?,learnmachinelearning
183,Report Framework - Trying to move away from Excel for report creation and management,datascience
584,Any ML study group or meet-up working in projects/ research papers.,learnmachinelearning
1519,How not to write Python comments,Python
151,really feel like Data Science gets romanticized and people don't talk about the support aspect.,datascience
1072,"profiles of nearly 5,000 computer science professors in a spreadsheet",compsci
1270,"My 7 yr old little brother has Autism and has been very interested in Python lately, what resources can I give him so he can learn programming completely and properly?",Python
483,Kaggle Expert Notebook!,learnmachinelearning
28,Does my current salary seem appropriate for my location & experience?,datascience
1484,"I just had a baby, so naturally I had to program a tool for deciphering his schedule",Python
1343,"Web scraping and bypassing ""Activate and hold the button to confirm""",Python
674,Looking for open source ML projects to contribute to,learnmachinelearning
1029,Computer science: The history of computer development,compsci
921,Why does scientific computing today still use only technology of the last century?,compsci
1162,Made a Screen Dimmer based on Facial Recognition with OpenCV and AppleScript!,Python
1078,Stanford Professor Wins 'Nobel Prize' of Computer Science World | San Jose Inside,compsci
1184,Can we not circle jerk?,Python
1477,Wrote this program to skip Spotify Ads using Spotify API,Python
1528,Tkinter for python 3.10 broken on MacOS?,Python
355,Formula 1 - Predict count of drivers for future championships,datascience
825,These plants do not exist,learnmachinelearning
428,I printed a second Xbox arm controller and decided to have an air hockey AI battle . I used unity to make the game and unity ml-agent to handle all the reinforcement learning thing . It is sim to real which I am quite happy to have achieved even if there is so much that could be improved .,learnmachinelearning
187,Is there a software/method to find common traits between arrays of data (50 different crypto trades)?,datascience
49,"“If you met me in a bar, you’d never think I was a data scientist,” she says, describing herself as a motorcycle-riding, bird-watching nerd. “Until I sit down and talk zettabytes of data.”",datascience
166,Is decision science really a thing? Or is it more marketing buzz?,datascience
1303,Python Poetry A Dependency Manager — pygists.com,Python
1108,Should an A* pathfinding visualizer use diagonal paths?,compsci
418,List of Top 5 Powerful Machine Learning Algorithms That Will Solve 99% of Your Problems,learnmachinelearning
461,Machine learning debriefed,learnmachinelearning
1288,PyPrograming Starter,Python
157,"""Using data science as a force for good"" environmental modeling workshop",datascience
175,Automatic Wordle solving,datascience
411,Started learning today and tried classifying my face using my facial recognition AI...,learnmachinelearning
460,"Activation Functions: Neural Networks Sigmoid, tanh, softmax, ReLU, Leaky ReLU, EXPLAINED !!!",learnmachinelearning
1454,It takes a village to build an open-source project and a single a**hole to demotivate everyone,Python
1171,I maDe a sCriPT thAT raNdOMlY cApiTAlIZes lEtTErs iN a SEntENcE,Python
881,"Donald Knuth Deemed Me ""A Gentleman and a Hacker""",compsci
458,How can I advance my completely new and very promising algorithm for unsupervised pattern recognition?,learnmachinelearning
1267,The Ultimate Guide to Python Lists - A detailed tutorial.,Python
450,Top 10 Data Science Algorithms You Must Know About!,learnmachinelearning
359,"Is data science turning into a ""catch all"" title for recent Ph.D grads?",datascience
1288,What is \b realistically used for?,Python
435,"Prorevenge post generated by an AI I made. (Warning: Has errors and swearing. Also, doesn't make sense, but it's interesting.)",learnmachinelearning
91,"I'm sick of ""AI Influencers"" - especially ones that parade around with a bunch of buzzwords they don't understand!",datascience
195,How can I help my new-hires understand the company's DB? I basically want to translate to plain english what each table actually contain. Hadn't realized how hard this actually was for someone unfamiliar with the db.,datascience
1069,Most Beautiful Question of Computer Science ( Math),compsci
60,I got a job!!,datascience
863,Ask Compsci: Best music to study CS?,compsci
1088,"What do you think about the statement ""You don't learn software engineering at university""?",compsci
838,"here are our 40 courses, 4 academic years Computer Science curriculum in 1079 YouTube videos. The best thing is that is FREE, easy to access by everyone, and opens many other resources in form of other recommended videos or references in the descriptions.",learnmachinelearning
504,AI That Can Potentially Solve Bandwidth Problems for Video Calls (NVIDIA Maxine),learnmachinelearning
1501,"Does anyone else, who knows Python, not like Lua?",Python
565,I want to create a pill counter using points instead of bounding boxes. What model should I train from?,learnmachinelearning
82,[video] How to learn data science in 6 months without formal education,datascience
610,Finding good dataset for diagnosing crop disease project,learnmachinelearning
0,Why do we see so many daily posts from people hoping to bypass getting an education?,datascience
1285,Why are search results so bad for Python?,Python
1539,"Quickly fetch your WiFi password and if needed, generate a QR code of your WiFi to allow phones to easily connect. Works on macOS and Linux and Windows",Python
217,Quick Primer: players in the hiring process,datascience
1272,"I made a chat application in python (not beginner friendly) because I'm very bored, hope you enjoy",Python
1131,"It's time to migrate to Python 3.x guys, seriously.",Python
165,Does anyone here make over $300k? What’s your title what do you do?,datascience
563,YOLOX + Emotion Detection with Facial Recognition ⭐Enroll Now - https://lnkd.in/deRj6SPf,learnmachinelearning
1540,"Why Python 4.0 might never arrive, according to its creator",Python
501,Types of Neural Networks,learnmachinelearning
21,:),datascience
1488,Learning the language starting today!,Python
449,I made an Instagram Bot for creating DeepFakes! @deepfake.maker,learnmachinelearning
1469,leontrolski - OO in Python is mostly pointless,Python
943,Who killed Kurt Goedel's mentor? A University of Vienna Professor gives me an incredible explanation. From /r/PhilosophyofScience. ,compsci
1494,The Single Most Useful Decorator in Python,Python
898,"I'm choosing a language to learn out of the following (in description).  I would love to hear what you guys think I should do, and why. Thanks!",compsci
381,Applications of tensors in data science?,datascience
485,Siraj Raval admits to the plagiarism claims,learnmachinelearning
632,Federated learning in a nutshell,learnmachinelearning
1167,Got my first job as a developer!,Python
1267,This is the sixth birthday of the Python Arcade library!,Python
824,🍒🥕 I developed this device that collates spectral color data of varying fruits and vegetables with Arduino Nano 33 IoT to detect ripening stages based on spectral color with a TensorFlow Keras neural network model.,learnmachinelearning
1151,"I made an AI opponent for lesser known board game - Chain Reaction. Apparently, it plays better than me!",Python
1301,Just created my very first discord bot using discord.py,Python
455,No Facebook... These items are not similar to a telescope !,learnmachinelearning
1078,"Seasoned Researchers and Professors here, do you have any treasures to share with aspiring guys like this?",compsci
424,I created opencv object tracker which can write in air,learnmachinelearning
396,How would you feel about a handbook to cloud engineering geared towards Data Scientists?,datascience
1060,Decomposing 1810's top hit with C++ and DFT,compsci
1104,"Undecidability of Learnability. ""[T]here is no known general-purpose procedure for rigorously evaluating whether newly proposed [machine learning] models indeed successfully learn from data. We show that such a procedure cannot exist."" [abstract + link to PDF, 28pp]",compsci
1114,Apple's M1 Chip Has a Fascinating Flaw,compsci
1214,"Work laptop doesn't allow minesweeper? I'm gonna build my own minesweeper, with blackjack, and hookers! In fact, forget the hookers!",Python
934,BRCA1–BARD1 promotes RAD51-mediated v gvhomologous DNA pairing : Nature : Nature Researchg,compsci
1064,Question about GitHub,compsci
1094,"Turing Complete - A neat ""NAND to Tetris"" style puzzle game, where you start out with basic logic gates, and work upward eventually programming your own virtual computer!",compsci
172,Which solution to aim? (data scientists types),datascience
369,Why is logistic regression called a machine learning algorithm?,datascience
83,Im an English major who has a job interview as an associate data scientist tomorrow. All I really know about is some things on excel.,datascience
86,Best companies in Bay Area to apply to for a first time data science role?,datascience
409,"Building a tool with GLT-3 to write your resume for you, and tailor it to the job spec! What do you think?",datascience
65,Map of Data Science,datascience
349,Day in a life,datascience
1071,Want an invite to Google foobar?,compsci
597,Need help,learnmachinelearning
1168,Recursively flipping and rotating an image. Python source code in comments!,Python
1233,When to use dict.get in Python (timing),Python
406,"Can we begin to understand possible mathematical reasons as to why algorithms like ""xgboost"" and ""random forest"" win Kaggle Competitions, instead of neural networks?",datascience
892,The Science in Computer Science: The Sixteen Character Traits of Science,compsci
1474,"Google Translate, but for Sign Language - I used Python and OpenCV AI Kit to perform Sign Language Detection.",Python
57,Distributed Computing and SQL,datascience
599,Do I need study data structures and algorithms for machine learning?,learnmachinelearning
596,"Knowledge Distillation, Model Ensemble and Its Application on Visual Recognition - Link to a free online lecture by the author in comments",learnmachinelearning
1190,What's up with Python people and Ruby?,Python
1284,Starlite: the little API framework that can,Python
1531,Object-Oriented Programming with Python,Python
1132,"I am a medical student, and I recently programmed an open-source eye-tracker for brain research",Python
416,ML Programming Made [too much] Easy,learnmachinelearning
1121,I redesign the Python logo to make it more modern,Python
1284,I made a game in 1 day with pygame,Python
884,A Proof for P vs. NP Problem,compsci
898,[R] AI Generator Learns to ‘Draw’ Like Cartoonist Lee Mal-Nyeon in Just 10 Hours,compsci
162,Books on Model Deployment,datascience
1415,"My first open-source package on PyPI: `spectrumdevice`, a high-level, object-oriented library for controlling Spectrum Instruments digitisers. A bit of a niche one!",Python
440,"Hi guys, I've made a Personalized Face Mask Detector. Im still pretty new to ML but I've taken a couple courses and thought I should build something relevant for today's situation. It only allows access if the mask is worn correctly, i.e. over the Mouth and Nose. Please let me know what you think",learnmachinelearning
649,Implementation of the U-NET Architecture in Keras,learnmachinelearning
1473,"Stop hardcoding and start using config files instead, it takes very little effort with configparser",Python
1066,fatal bug example therac 25,compsci
843,Global MLOps and ML tools landscape,learnmachinelearning
1316,3 Things You Might Not Know About Numbers in Python,Python
423,Social distances using deep learning anyone interested I am planning to write a blog on this,learnmachinelearning
1465,"Be an absolute beginner at python: Check, have co-workers think I'm performing black magic : Check",Python
1103,Rainbow Tables (probably) aren’t what you think - An explanation of how rainbow tables differ from lookup tables,compsci
1077,Data Science Core Skills – What Matters the Most in 2021,compsci
1525,Setting up Anaconda on Windows 10 machine,Python
40,Why is Python so popular?,datascience
95,It seems a lot of people want to get into the data science field without having the slightest idea of what it actually entails,datascience
400,Continue interviewing after a bad experience?,datascience
946,A Introduction to Tox — Free & Open Source Messenger with Audio/Video Calls as Skype Alternative,compsci
1025,We call upon Reddit to take action against the rampant Coronavirus misinformation on their website.,compsci
1100,"Bias in AI - What is it, why does it happen and can it be fixed?",compsci
490,AI for Businesses,learnmachinelearning
833,The hitchhikers guide to computer vision,learnmachinelearning
1368,Free online version of Humanities Data Analysis: Case Studies with Python,Python
1457,Python in Visual Studio Code – May 2021 Release,Python
1146,Thought this looked familiar...,Python
487,ML and DL Interview Questions,learnmachinelearning
1286,Master Dataclasses in Python Part 3 - Ordering of Dataclasses,Python
1515,Thought I'd make a list of all the best ways to learn Python I found on the net and help the newbies.,Python
1089,Running a comp sci club.. in a pandemic,compsci
1504,Unpopular Opinion: Type hints are a mistake...,Python
351,What is the most well-paid components of data science?,datascience
418,Example of Multi-Agent Reinforcement Algorithms,learnmachinelearning
580,The Best Machine Learning Courses on Udemy (2022),learnmachinelearning
899,Computational complexity - Big O notation,compsci
1022,Software development is a creative process; an original masterpiece not a paint by numbers,compsci
1170,Emacs - the best python editor?,Python
367,Are there data science jobs that don’t require a lifetime dedication?,datascience
96,What kind of data science do you perform? Analytical [A] or Building/ML [B]? Which is more in demand?,datascience
47,4 Reasons Why Economists Make Great Data Scientists (And Why No One Tells Them),datascience
935,Why don't non-compsci posts get removed?,compsci
1177,My python image/GIF glitching library is now on pypi!,Python
1259,"Python is ""Language of the Year for 2021"" according to TIOBE",Python
368,What is your definition of Data Science?,datascience
1311,Learn TensorFlow & Deep Learning fundamentals with Python (code-first introduction) part 2/2,Python
886,Computer Science Book Reading List,compsci
1261,Top 20 Most Useful Packages Article,Python
848,Which is best YouTube channel to learn Machine learning?,learnmachinelearning
429,"Difference in Image Classification, Semantic Segmentation, Object Detection, and Instance Segmentation",learnmachinelearning
1290,Save WhatsApp Status With Python On Android,Python
854,"Logic gates with fluid, part 2",compsci
39,when I start EDA on a new project,datascience
600,"Nueral networks from scratch in python, part 1",learnmachinelearning
350,"I got into Data Science out of necessity, and now I don't know if I want to switch out or not, should I try looking for something else?",datascience
1109,Connected Papers partners with arXiv: a visual tool to find and explore academic papers,compsci
481,"Blogger has built a home ""torture machine"" for sports",learnmachinelearning
1209,TIL that in PYTHON it's preferable to ask for forgiveness rather than look before you leap,Python
573,"[Research 2021] Looking for interesting ML papers to read for the break or the new year? Here is a curated list I made. (with video explanation, short read, paper, and code for each of them)",learnmachinelearning
156,Can you connect PyCharm Community to Microsoft SQL Server?,datascience
446,What do you use?,learnmachinelearning
38,"My project is stuck because my client wants 500,000 Facebook profiles of certain type, which...",datascience
1342,Python extensions in Rust -- Lessons learned from upgrading a bioinformatics package,Python
880,Jump Rope + AI! Made this application on top of OpenPose (Python). Link to the Medium tutorial and the GitHub Repo in the thread.,compsci
888,"Well, damn!",compsci
1164,"We started late, but we managed to leave Python footprint on r/place!",Python
188,How far can a certificate in data science get me if I also have a degree in a math heavy science?,datascience
485,Is there any way to make pocket money with ML while learning ML?,learnmachinelearning
622,What is a mean and an expected value? A 2-minute visual guide. [OC],learnmachinelearning
352,Am I too old to do this?,datascience
732,Has anyone experience val loss curves like this?,learnmachinelearning
1470,18 Common Python Anti-Patterns I Wish I Had Known Before,Python
1201,how do I insert python in my html-css web pages ?,Python
390,Looks like the expected number of dating app matches one can get in Iceland is 187?,datascience
794,Removing NAs from data be like,learnmachinelearning
1388,CSM Token grabb,Python
1491,QR Code UI,Python
1268,EMOJILANG: A programming language where you can code using emojis🗿,Python
828,How to choose a metrics for the business??? So that my machine learning models metrics correlates to the success of the business???,learnmachinelearning
488,Image Classification with Pytorch,learnmachinelearning
637,Pandas won't let me use fillna on a column when passed into a function,learnmachinelearning
804,Left-wing vs Right-wing labelled data,learnmachinelearning
179,Masters in Data Science or in Artificial Intelligence?,datascience
1496,I did it!!,Python
629,Convolutional Neural Network from Scratch,learnmachinelearning
885,How Hard is Computer Science,compsci
1533,"I learnt to use ASTs to patch 100,000s lines of python code",Python
1198,A Command Line Stock Dashboard,Python
1161,This post has,Python
1499,"Second year calculus done entirely in PYTHON: No pencil or paper is required! Included are things that are traditionally a pain to deal with, such as path and surface integrals. See comments for more info",Python
1464,"Hey Reddit, here's my comprehensive course on Python Pandas, for free.",Python
1274,"GitHub - Goldziher/starlite: Light, Flexible and Extensible ASGI API framework",Python
1050,2D Turing-Machine that computes any 1D Cellular-Automaton in Minecraft,compsci
1082,Computational Ayahuasca: Simulating DMT on Artifical Neural Network,compsci
141,"Which course would you suggest to opt for first, Machine Learning or Data Mining?",datascience
1093,Does anyone have any practice problems for class and method writing for ap cs a?,compsci
916,I made an interactive solver for the traveling salesman problem to visualize different algorithms. Each step of progress is drawn to the map in real-time and can be controlled all in the browser at tspvis.com.,compsci
1091,Theoretical breakthrough could boost data storage,compsci
494,ONNX.js Tutorial with ReactJS for object detection on a website.,learnmachinelearning
55,Fun stuff - How to forecast AAPL with auto arima in RStudio and predict future trends!,datascience
894,"Enthusiasit: As I learn to code, what is the true complexity of this algorithim?",compsci
1322,Ascii-Weather: A minimal shell weather program,Python
1472,some facts about the for loop in python,Python
383,Data visualization software with best performance and decent graphics,datascience
184,How to deal with feature selection?,datascience
803,Learn how to Forecast Sales using Excel/Python(ARIMA)/Python(Prophet),learnmachinelearning
1144,"A tool that copies a selected area of your screen, not as a picture, but as pastable text (GitHub in comments)",Python
366,I translated it from Prussian for y'all,datascience
1470,prettymaps: A small set of Python functions to draw pretty maps from OpenStreetMap data,Python
903,Reverse Engineering Disassembled Programs,compsci
482,iperdance github in description which can transfer motion from video to single image,learnmachinelearning
