,text,label
1037,New method to reduce characters in binary coding - storing? Would like to hear your opinions on this…,compsci
558,From 53% to 95% acc - Real vs Fake Faces Classification | Fine-tuning EfficientNet (Github in comment),learnmachinelearning
926,Is there a University that proposes a master degree linking AI and Climate Change ? Or any organisation that searches someone in those domains ?,compsci
1099,GitHub Copilot Generated Insecure Code In 40% Of Circumstances During Experiment,compsci
801,Loading Keras Model,learnmachinelearning
405,Standing desks?,datascience
357,Is it difficult to stay in shape as a professional data scientist? Appreciate any insights regarding the health aspect of the job,datascience
945,"American computer science graduates appear to enter school with deficiencies in math and physics compared to other nations, but graduate with better scores in these subjects.",compsci
32,I don't understand why DS has code tests,datascience
1378,Python bytecode explained,Python
417,Want to move onto from Python but I feel that I'm not going to enjoy another programming language as much as I like Python,learnmachinelearning
391,Selling Data,datascience
1128,Make Lisp 15x faster than Python or 4x faster than Java,Python
575,Backpropagation from Scratch in Python,learnmachinelearning
1455,I made a Finance Database with over 180.000 tickers to make Investment Decisions easier,Python
1144,My biggest struggle while helping newcomers with Python,Python
1345,Web api benchmarking: Python (Flask) vs Rust (actix-web),Python
508,Using Drones to detect potential Covid-19 patients.,learnmachinelearning
1516,"""Automate the Boring Stuff with Python"" online course is free to sign up for the next few days with code APR2021FREE",Python
1481,Enable ++x and --x expressions in Python,Python
1340,pytest-neo is a plugin for pytest that shows tests like screen of Matrix.,Python
148,Is Data Science 90% boring and 10% mega-interesting?,datascience
508,AI basketball analysis web App and API,learnmachinelearning
365,Data scientist is a bad title,datascience
1377,interleave — Run iterators in threads and collect their values,Python
910,What will personal computers be like in 50-100 years time?,compsci
399,Where to go?,datascience
1141,I was having way too much fun with a script and decided it needed an appropriate logo. Hope you enjoy!,Python
850,Rotating an image recursively. One of my favorite algorithms!,compsci
443,Neural Networks Cheat Sheet,learnmachinelearning
921,"OR, AND, XOR gates using dominoes",compsci
932,"A list of 30+ free textbooks from calculus, linear algebra to discrete math, proof, combinatorics and programming",compsci
1068,Tried animating a DFS traversal using python,compsci
1068,What is the significance of CORS? (Cross-origin resource sharing),compsci
170,How should constant ad-hoc requests be handled by a data science team?,datascience
1219,"Learn You Some Algebras for Glorious Good! - a fun, easy-to-read math textbook. (It's also free, in both senses).",Python
1331,Generating time-lapse videos of Earth from scrapped satellite images.,Python
358,Zindi's official response to claims of unfair treatment by u/maroxtn,datascience
190,Anyone else work in agriculture?,datascience
1502,"Using a combination of lambda functions, list comprehension, and ternary operators, (and Pygame), I was able to make Flappy Bird in one line of Python!",Python
1193,An alternative lambda syntax for Python,Python
646,Are there any papers on this?,learnmachinelearning
371,SQL why do I see it as recommended knowledge for most internships but isn’t taught in college.,datascience
626,Can overfitting pass unnoticed because of a small dataset?,learnmachinelearning
912,"If the halting problem says no program can determine if a program terminates, how can I know while(true){skip} doesn't terminate?",compsci
1282,Convert Spotify url to mp3,Python
1469,"We're building an app that lets you search Stack Overflow, Python documentation, and code on GitHub",Python
167,Is Tableau a good software to become Data Visualization Designer without learning to code?,datascience
1065,Can someone help explain why there might be issues with using cloud services for a company/industry?,compsci
1155,Python has a sense of humor,Python
420,Fun question: Anyone learning ML here in something other than Python or R?,learnmachinelearning
833,"What specific ML technique should I use for predicting a country's religion through the attributes of its flag (colors, stripes, crosses, etc)?",learnmachinelearning
560,What is an eigenvector? A 2-minute visual guide.,learnmachinelearning
938,Found a great image explaining difference between a secure and unsecure password,compsci
193,For data tools do you prefer a desktop or a web version?,datascience
832,What if you could learn Machine Learning only through tweets?,learnmachinelearning
83,Python package to collect news data from more than 3k news websites. In case you needed easy access to real data.,datascience
1133,"MS is considering official Python integration with Excel, and is asking for input",Python
1217,I created a python program for interactive batch cropping,Python
367,"""I'm gonna make him a Neural Network he can't refuse"" - Godfather of AI",datascience
580,Data Scientist vs Machine Learning Engineer?,learnmachinelearning
578,Can an ML model have 100 per cent accuracy?,learnmachinelearning
399,Is it normal to feel guilty when you don't work much on a work day?,datascience
89,Rank the Data Science Titles,datascience
851,CS Is My Life - University of Waterloo,compsci
872,So you want to get a PhD in theoretical computer science,compsci
905,The undecidability of the halting problem is not very important,compsci
1462,🐍 Strategy Design Pattern in Python,Python
569,What is overfitting? A 2-minute visual guide.,learnmachinelearning
596,Machine Learning vs Deep Learning,learnmachinelearning
1094,3D ray-tracing two fully reflective spheres,compsci
890,Dead simple points interpolation with good old C++,compsci
459,Siraj posts a new apology video,learnmachinelearning
382,I only have about 10-15 hours of work to do.,datascience
194,GoLang or Rust -- Do they have a place in Data Science?,datascience
1200,These two books changed my life in 2018!,Python
1526,"Hi, here is a file manager app built with python",Python
1148,Finished a program that draws images with epicycles!,Python
1086,Algorithms for Proof of Stake,compsci
1187,I made a project that generates the graph,Python
1097,Scott Aaronson receives 2020 ACM Prize in Computing,compsci
815,"Need to learn following topics for ML test(stats section), where can I learn them from? Help would be greatly appreciatef :)",learnmachinelearning
572,Overview of Machine Learning - A Powerful Artificial Intelligence Tool,learnmachinelearning
806,Top 10 youtube channels to learn machine learning,learnmachinelearning
894,[R] Impersonator++ Human Image Synthesis – Smarten Up Your Dance Moves!,compsci
1057,Uncovering a 24-year-old bug in the Linux Kernel,compsci
1181,"What does =_ mean? Example: name=forms.CharField(label=_(""Name""), max_length=50)",Python
916,"960 cores, 4 teraflops - on your desk!",compsci
1261,"Announcing Lingua 1.0.0: The most accurate natural language detection library for Python, suitable for long and short text alike",Python
379,"As someone who lives in a country with no BI or Data Visualization scene, how can I build a network online with people in North America or Europe?",datascience
639,Question about information loss when reducing image size.,learnmachinelearning
1113,Evolution of computing level,compsci
387,Do you think Data Science and 3D Scanning/3D modeling/3D printing could be somehow related?,datascience
901,Redditors wanted to participate in a survey that I am conducting as part of my dissertation.,compsci
699,Help to Run the codes from research papers,learnmachinelearning
1297,"Smarthome with python, raspberry, grafana and influxDB",Python
827,Is there a better notebook tool than Jupyter for cloud ML?,learnmachinelearning
1281,I used Python to make a dot density map (with 1 dot per person) for the US Decennial Censuses from 1990 to 2020. This is over a billion points. The result is an amazing way to visualize population and demographic changes over the last 30 years. I wanted to share the code + process I used.,Python
945,"[Showerthought] I used to wonder why people hate using some languages, and would be almost evangelical with their favorites. Now I don't.",compsci
795,"What is x_train and y_train of a dataset I see in many tutorials. Can I have Multiple Coloum in y_train,if so how?",learnmachinelearning
1290,Just created an open-source text adventure game engine. Still didn't upload to PyPi but will soon!,Python
150,What algorithm am I looking for here???,datascience
1154,So I made a Python and Arduino project that dynamically changes sets the ambient lighting to match the computed dominant color values from the wallpapers.,Python
1502,CommieScript,Python
1057,How does hex to base64 encoding actually work?,compsci
1453,"Happy birthday, Python, you're 30 years old today: Easy to learn, and the right tool at the right time",Python
1193,Microsoft Considers Adding Python As an Official Scripting Language in Excel,Python
1138,Happy Holidays! Made a user-directed greeting card using Python Turtle Graphics,Python
813,Handshape classification of Australian Sign Language,learnmachinelearning
448,I certainly have some experience with DSA but upto which level is it required for ML and DL,learnmachinelearning
1207,A Python Program that attends your online classes for you,Python
9,No PHD Data Scientist - Avoiding Theory Hell,datascience
847,Mathematics and Machine Learning Free Resources,learnmachinelearning
1476,"New search engine made with Python that's anonymous and has no ads or tracking. It tries to fight spam, and gives you control of how you view search results. You can search and read content anonymously with a proxied reader view. The alpha is live and free for anyone to use at lazyweb.ai",Python
579,I'm reading about Maximal Margin Classifier and have some questions about it. Details in comments.,learnmachinelearning
500,What is Logistic Regression in Machine Learning? How it Works?,learnmachinelearning
1300,"I made a cli snake game being a begginer, Im so happy:3",Python
1466,Create splash pages in less than 20 lines of python for free. Splashgen is an open source project,Python
1047,I SUCK AT DISCRETE MATH AND DONT KNOW WHAT TO DO,compsci
1104,Comparison of modern video formats,compsci
867,Sorting Algorithms Visualized [gifv],compsci
1330,Automate your life with Python,Python
851,Happy birthday Alan Turing!,compsci
946,"I have started a new Youtube channel about making the ""theory"" classes in CS as easy as possible.",compsci
356,My first technical interview experience(22+ interview questions),datascience
1146,Mildly infuriating: being a complete novice to a new language and trying to get past the first tiny hurdles...,Python
173,Curious on the education background of this sub,datascience
1509,What to expect in Python 3.10 🤯,Python
1120,Python 3 is killing Python,Python
625,Is MatLab worth learning professionally?,learnmachinelearning
54,Made this when I first got into data science. All I can say is that it looks cool but makes no sense at all. Yikes.,datascience
1062,"I designed a CPU and made it print ""Hello World"" via DMA requests(details in comments).",compsci
178,The (right) amount of domain knowledge for DS,datascience
557,Created my FIRST Neural Network Python library called CrysX-NN,learnmachinelearning
810,15 Best Udacity Machine Learning Courses,learnmachinelearning
1336,What is the best strategy to align coding practice across the team?,Python
1143,A Python GUI for uninstalling the default Windows 10 apps.,Python
693,Stopping a Text Prediction Model Automatically,learnmachinelearning
787,Deep Reinforcement Learning Neural Network,learnmachinelearning
150,Is medium even proofreading submissions at all?,datascience
1124,"I'm excited to share my first published book, Introduction to Python Programming for Business and Social Science Applications -- specifically geared towards students not specifically in computer science",Python
804,[Project]YOLOR Object Detection for Rapid Website Code Generation,learnmachinelearning
930,Is floating-point obsolete? Is there a way to represent values better? Here is an alternative.,compsci
1528,rock paper scissors in less then 10 lines of code.,Python
733,"What is the state of AI? This is the question I try to answer on my blog monthly, hoping to provide valuable information and insights to our community and those outside the field.",learnmachinelearning
591,Machine Learning adventures with MLFlow - Deploying models from local system to Production,learnmachinelearning
1070,The Unparalleled Genius of John von Neumann,compsci
1258,"I'm teaching myself basic web scraping in my spare time, so I wrote this script that scrapes current info on the James Webb Space Telescope off NASA's website!",Python
1481,The Best IDE for Programmers Ever Built? Meet Fleet by JetBrains,Python
1114,Uncomputable Numbers,compsci
354,I’ve made a search engine with 5000+ quality data science repositories to help you save time on your data science projects!,datascience
1275,I'v just made my first Not-meaningless GUI program.,Python
1166,hashtags,Python
1494,"Got a job that requires Python and Django developement, also using Tkinter and Pyqt for desktop apps.",Python
1098,Donate your voice to an open-source project by Mozilla,compsci
1294,I made a GLaDOS virtual voice assistant bot,Python
1192,Image upload and moderation with Python and Flask,Python
889,Bought a few things for my personal project. Looking forward to digging in soon!,compsci
597,Check out my first blog post! Its on a similar image search I built over the last few days using PyTorch,learnmachinelearning
1168,Flying with web2py in Google App Engine,Python
1053,/compsci Subdirect Statistics,compsci
889,Chatbot passes Turing test,compsci
1206,Joining string in Python,Python
1534,Java programmer coming to Python for the first time...,Python
28,Recruiters be like,datascience
346,Is it ok to use Google sheets in stead of excel now?,datascience
1493,Comprehensive Python Cheatsheet - It's HUGE,Python
1529,"I was hired partly because of my knowledge of python, but head of IT won’t let me install it…",Python
641,Learn How to Implement Gradient Descent From Scratch in 4 mins with Python,learnmachinelearning
899,Alan Turing to feature on new £50 note,compsci
1127,"Thanks to everyone’s advice, my mouse drawing algorithm has gotten much better and faster!",Python
1140,Laid off for 8 weeks. Anyone else starting their python journey?,Python
1547,How to use an API?,Python
648,How to remove Missing Values in sklearn Pipeline?,learnmachinelearning
61,Being a recent graduate,datascience
1378,Is Spring Python dead?,Python
693,10 Amazing Benefits of Machine Learning You Should Be Aware Of!,learnmachinelearning
628,I need helpwith id3 implementation in Python. It kinda works but needs better output for predictions. Like tree as nested dictionaries. I can send code in pm.,learnmachinelearning
1052,Colored ASCII generator (image2image and video2video) (Code: https://github.com/uvipen/ASCII-generator),compsci
76,Too True,datascience
1292,where should i start?,Python
909,How can I pursue PhD in Programming Languages from non CS background ?,compsci
1429,Friday Daily Thread: Free chat Friday! Daily Thread,Python
1044,Software for tracking opened files / directories,compsci
435,Built a Real-time Sudoku Solver! Basic Image Processing + a little Deep Learning. It's quite intriguing how simple pieces of codes can do magical stuff! Check the thread for the GitHub repo and references!,learnmachinelearning
1314,"Why python seems to attract all ""script kiddies""",Python
510,What has happened to Siraj Raval?,learnmachinelearning
355,Thank you r/datascience & r/dataisbeautiful - you guys helped me get my dream job! ❤️,datascience
489,An Interesting Map Of Computer Science - What's Missing?,learnmachinelearning
928,Time to go back to the table — hex multiplication table that is.,compsci
1475,Thanks for letting me join the community ❤️,Python
928,"Is computer science ""fun?""",compsci
826,[R]Rmse is differentiable?,learnmachinelearning
836,Zomato Data Analysis with Jupyter Notebook,learnmachinelearning
821,Models are just a piece of the puzzle,learnmachinelearning
1036,"If we have programming languages ready for quantum computers then why aren't we using them for something like AI, crypto etc?",compsci
1119,[N] Yann LeCun Team's Barlow Twins Method Boosts SSL in Image Representation via Redundancy Reduction,compsci
585,alternative to google colab,learnmachinelearning
1491,tkinter was shockingly easy to write a small overlay GUI,Python
1085,Hey guys! Hope this is right place! I am drawing logic gates.. Is this correct for (AB + C)D?,compsci
608,Efficient Geometry-aware 3D Generative Adversarial Networks | GAN Paper Explained,learnmachinelearning
604,A model that can learn and replicate the art style of a Twitter artist...is this real? ¿Where can I find It?,learnmachinelearning
204,In an Enterprise setting what is mostly used for data visualization?,datascience
504,Does the fucking mathematics or theory ever get any easier?,learnmachinelearning
210,Product Data Science Materials Recommendations?,datascience
717,A neural search plugin for elastic/opensearch,learnmachinelearning
1080,Programming/computer science stories with real-world consequences?,compsci
1394,Created an ISS tracking script using NASA's API,Python
594,Getting overwhelmed,learnmachinelearning
1302,"Python Virtual Environment. What, Why, How. Virtualenv, Poetry.",Python
501,Found this on r/funny seems appropriate for this sub.,learnmachinelearning
1297,Dj-Snake: Django command to load fixture without overriding existing objects with same primary key,Python
42,Whats the proper answer if your CEO asks you to do an ad hoc analysis asap yesterday?,datascience
796,Hey everyone! This is a project of mine that I have been working on. It is a video captioning project. This encoder decoder architecture is used to generate captions describing scene of a video at a particular event. Here is a demo of it working in real time. Check out my Github link below. Thanks,learnmachinelearning
816,The Best Machine Learning Courses on Udemy (According to Experts),learnmachinelearning
80,A quick and dirty exploration of housing prices in Amsterdam [OC] [x-post /r/dataisbeautiful],datascience
1165,An update on Python 4,Python
1389,An easy-to-use library to manage the dependencies of your GUI elements with IPython,Python
581,"I have come up with a dataset with DTC codes of vehicles. 1,0s indicate whether each component is in working state of fault state when the code is generated. 1-faulty , 0-working. How can I automatically add labels to the label column to train this dataset? E.g:B1200-Vehicle body issue",learnmachinelearning
1167,How to Fail In a Successful Way at Anything You Do as a software developer,Python
1170,I made a ray tracer that simulates curved spacetime by using Einstein's field equations from general relativity. Here's a black hole!,Python
1132,Windows Desktop Notifications in 3 lines of Code | Python 3.6,Python
1145,"Python project that answers high-school problems almost instantly. Made using Tesseract, Scrapy and Flask.",Python
472,[off-topic] Winnie-the-Pooh Artificial Intelligence roadmap,learnmachinelearning
823,What language should a beginner learn?,learnmachinelearning
908,[P] Nifty Online Tool Animates Your Actions in Real-Time,compsci
1126,I made a simulation using Python in which a neural network learns to race,Python
1511,18 one liners every python developer should know to improve their coding process.,Python
98,Need some advice for my first data science internship,datascience
1311,pyfuncol: Functional collections extension functions for Python,Python
1301,Naruto Best Quotes Using Python,Python
1490,Python library to create a Spectacular Visualizations,Python
197,COVID case data and US airline travel data together in a panel regression. 😱🦠,datascience
1507,You can insert Emoji using `\N{NAME_OF_EMOJI}`,Python
1461,7 Visual Studio Code Tricks For Python Developers,Python
1050,Periodic Table of Base Data Structures (draft),compsci
869,Why Was 5 x 3 = 5 + 5 + 5 Marked Wrong,compsci
618,collection of free python courses,learnmachinelearning
856,Why are loop invariants so rare in CompSci (and in code)? They can give you coding superpowers!,compsci
75,Infographic: R vs Python for Data Science,datascience
55,How to learn data science “best practices” if you’re the only data scientist at your first job?,datascience
815,Build your own interactive learning roadmaps: added map editor to Learney,learnmachinelearning
1162,"Battle of the server side scripting languages Perl, PHP, Python",Python
806,A different way of thinking about learning machine learning,learnmachinelearning
1432,"Optimizing code, version 1 clearly faster under profiler, version 2 clearly faster without. Why?",Python
1304,Appwrite 0.12 - A major milestone for the open source Firebase Alternative,Python
59,How to begin a career in data science,datascience
1204,I created a GUI that collates various interests of mine in one handy place,Python
1065,Must watch video on mathematics (the guts) of neural networks,compsci
1122,Automate the boring stuff with python - tinder,Python
699,Dimensionality Question,learnmachinelearning
189,Psych major pursuing Stats MS w/ the goal of going into DS?,datascience
859,Try this Crossword for Programmers !,compsci
202,I made a modern data catalog tool for anyone using a word document or excel sheet as a data catalog. I’m curious if anyone would like to try it out.,datascience
871,Felt like doing a portrait of one of our founding fathers,compsci
1401,py-buzz 3.0 released! Now you can use buzz features with any exception type,Python
1214,Announcing /r/pythoncoding: A subreddit for people who know how to program Python,Python
620,questions about the MITx courses on probably and statistics,learnmachinelearning
1333,"5% of 666 Python repos had comma typo bugs (including V8, Sentry, Tensorflow, and PyTorch)",Python
1210,"Spotlightify - a overlay controller for spotify, allowing you to quickly control your music without distraction. Please let me know if you are interested in this application as I am thinking of making it public on my github in the near future (once more features have been developed), thanks!",Python
574,20 Activation Functions in Python for Deep Neural Network,learnmachinelearning
1463,Pyfactor update 0.4: visualise source code structure as a graph - a command line refactoring tool,Python
436,10 Visualizations Every Data Scientist Should Know,learnmachinelearning
1341,Just made my first useful program.,Python
1042,Online photo book builder to license,compsci
1088,"Does there exist a program that inputs source code and outputs time-complexity, in the form of big-O notation, of that code?",compsci
1330,Writing CUDA kernels in Python with Numba | Meetup,Python
1208,No weapons are allowed at Python Software Foundation events.,Python
201,Could I consider myself a data scientist?,datascience
1211,I wrote a python script that I'm running on my phone to play a word game called Ruzzle.,Python
1518,Why you should learn Python with a Raspberry Pi,Python
176,How do you keep up-to-date with emerging tech and methodologies?,datascience
1468,An Interactive Python Cheat Sheet That Brings The Answer To You,Python
432,How NOT to write pandas code,learnmachinelearning
484,World's Best AI Learning Platform,learnmachinelearning
903,"My master's thesis on circle packing, in the form of an IKEA assembly instruction",compsci
789,Is an RTX 3050 good to learn Machine Learning and AI l?,learnmachinelearning
1480,Python just surpassed Java as the 2nd programming language with the highest number of questions in SO.,Python
902,Paper claiming existence of one-way functions (and hence P != NP),compsci
603,What are resources for learning ML without python or a bunch of frameworks?,learnmachinelearning
64,xkcd: Machine Learing,datascience
359,Anyone else cringe when faced with working with MBAs?,datascience
1441,Boolean Operators in Python,Python
611,How do they give control of a game to an AI?,learnmachinelearning
1116,Subway Station Hazard Detection,compsci
77,How should I begin to learn Data Science?,datascience
1382,Do you recommend Django or Masonite for high-traffic web applications?,Python
1408,Space Science with Python - Part 22: Comet in 3D,Python
943,"On this day in 1954, Alan Turing took his own life. He wrote this letter to a friend in 1952.",compsci
80,Landing a Senior Data Scientist Job After 6 Months of Unemployment,datascience
482,My alternative to Backprop?,learnmachinelearning
808,k-Means clustering: Visually explained,learnmachinelearning
138,"Python is ""Language of the Year for 2021"" according to TIOBE (& #1 Ranking!), and am sure the surging popularity of Data Science helped a lot in making that happen!",datascience
480,Why is Rust a Good Language of ML?,learnmachinelearning
215,"Actuaries who transitioned into data science, why?",datascience
453,"Happy 2021 Everyone , Stay Healthy & Happy",learnmachinelearning
941,I made a search engine to show the best paths for learning anything,compsci
592,"Training AI on ""Getting over it""",learnmachinelearning
1041,After years of coding I still feel like I don’t know how,compsci
