,text,label
407,Calling out Excel Pro Users,datascience
830,The 2nd Edition of An Introduction to Statistical Learning just released. Some great new topics have been added and it's still free!,learnmachinelearning
1039,Is there a way to make an AND operation with three RE?,compsci
1116,Are we approaching deep learning in the right way?,compsci
638,ML Deployment,learnmachinelearning
442,Is Andrew playing KSP ?,learnmachinelearning
692,Introducing a new AI framework,learnmachinelearning
1390,Python JSON Parser,Python
1135,I've made a 3D scanner that's fully automated using Python script on Android phone!,Python
1527,"Full Course - Financial Data Analysis with Python - Part 1 of 8 - Technical Analysis with DataFrames - Use DataFrames to load historical stock price data, Similarities with DataFrames and Excel, Learn about loc and iloc on DataFrames",Python
1254,Need a last minute Christmas present? How about turning your loved ones into a prime number using python!,Python
402,The percentage of adult Americans playing chess once a year was 3% in 2010. What data exists to compare that number to the Fischer era and today?,datascience
180,Has 2FA reached overkill?,datascience
1312,Update: youtube-audio-downloader,Python
1471,Texas Instruments’ new calculator incorporates popular Python programming language,Python
1498,PSA: Kite is a viral plugin that kills your system performance,Python
219,Looking for an open-source tool like KNIME & Rapidminer but allows downloading of code of the workflow,datascience
31,TIME’s “Superforecasters”... See if you can make it through without an eye-roll,datascience
1459,I really don't like python. How can I learn to enjoy it?,Python
803,Video: How to Deploy a Machine Learning Model Fast,learnmachinelearning
1035,Rethinking titles,compsci
1117,Echo Trees ~ Incentive Routing (Non-Blockchain Digital Gold),compsci
683,I'm new to data science and planning to make a model that has five numeric inputs and one numeric output:,learnmachinelearning
185,Best websites (paid) for historical tick data for Equities/ETFs/Indices,datascience
1338,Coding journey and project ideas for 2022,Python
904,Atom 1.0 Test Drive - Open Source IDE from Github,compsci
1487,"Flask 2.0 is coming, please help us test",Python
1300,Handy Python Functions,Python
17,The complete guide to learn Python in simple and easy steps.,datascience
10,Python just isn't worth the hassle,datascience
649,Using a Genetic Algorithm for a minimax fitness function?,learnmachinelearning
414,I am trying to make a game that learns how to play itself using reinforcement learning . Here is my first results . I am going to tweak the reward function and put more emphasis on smoothness .,learnmachinelearning
381,I'm offended by having to scale my data,datascience
827,The ultimate blueprint to getting a job in data science,learnmachinelearning
842,"Recent grad, would really appreciate some feedback on my resume.",learnmachinelearning
422,I have the best model in the town,learnmachinelearning
1126,Tools used by Python Super Stars,Python
613,[Notebooks Release] +30 Crypto Trading Notebooks for Kaggle's Crypto Competition,learnmachinelearning
67,"To All ""Data Scientists"" out there, Crowdsourcing COVID-19",datascience
1392,"I made a CLI app to download music, supports mp3, flac and m4a files, embeds metadata and album art, can download songs, albums and playlists! All advice, critique and feedback is welcome ^w^",Python
454,I'm learning a lot about NN,learnmachinelearning
492,Looking for an online course on ML + TF,learnmachinelearning
492,Lock & Unlock Ubunto system using OpenCV,learnmachinelearning
464,Best Machine Learning Books (See comments for the list),learnmachinelearning
76,Tattoos?,datascience
1130,"Is it just me, or is SQLAlchemy an unholy mess?",Python
1381,How to Create a Photo Mosaic in Python,Python
1417,OOPs and Mocking Meet at Dependency Injection,Python
1519,Wednesday Daily Thread: Beginner questions,Python
1205,A hilarious remake of Pong.,Python
627,CNN for any problem statement ?,learnmachinelearning
1043,What are the process states in Unix/Linux?,compsci
809,Statistics vs Geography,learnmachinelearning
841,"Maybe it's just me, but building individual data pipelines in Tensorflow/Keras can get quite involved.",learnmachinelearning
374,A lot of people entering this field are like over-fitted models,datascience
830,Don’t make this mistake with Scaling Data,learnmachinelearning
1535,"""Automate the Boring Stuff with Python"" online course is free to sign up for the next few days with code MAR2021FREE",Python
1087,Do programmers actually use Flowcharts/Pseudocode when planning a project?,compsci
849,Is this good for beginner who wants to learn statistics for Machine Learning ?,learnmachinelearning
949,"If I download Google Chrome source code and compile it in my machine, will it run faster than the ready to download version?",compsci
875,My library has a tribute to Alan Turing,compsci
678,Are there any internships for final year undergrads which focus on publishing a paper?,learnmachinelearning
472,Microsoft will not sell facial recognition software to police departments until regulations grounded on human rights are passed. The problem with facial recognition software in the US right now is that that the data sets used as training models are biased towards dark-skinned people,learnmachinelearning
198,Do you tend to forget your fundamentals?,datascience
734,What are some classification tasks for real estate dataset ?,learnmachinelearning
1145,"Python Performance Tips, Part 1",Python
211,Help Categorizing Text using Custom Categories in R,datascience
929,Dennis Ritchie has passed away. R.IP.,compsci
398,Got a job interview as a Data Scientist in an advertising agency. What are the Tasks?,datascience
1200,How to blink multiple LEDs at different rates on Arduino in Python LIKE A BOSS,Python
216,"What's the deal with ""manual entry"" job applications?",datascience
1169,I released the Code for the Instagram DeepFake Bot!,Python
584,What is Gradient Descent? A 2-minute visual guide. [OC],learnmachinelearning
1081,I made a simple algorithm for NFS Most Wanted in under 500 lines of code!,compsci
414,How to create stunning visualization using Python?,learnmachinelearning
222,Does anyone know of an article or blog about the Zillow fiasco from the viewpoint of a data scientist on the team?,datascience
451,Machine learning experiment,learnmachinelearning
881,Why a CS degree is better than teaching yourself how to code,compsci
633,What are Parametric and non-parametric statistics? A 2-minute visual guide.,learnmachinelearning
1101,New Algorithm that overcomes limitations by hash and B-tree indexes. Search by any possible search key combination in consistent high performance.,compsci
1128,Debugging Cheat Sheet,Python
1270,Removing duplicates form a list,Python
920,XML as a programming language syntax,compsci
157,no correlation,datascience
1367,Samila v0.4 : Auto Generative Art,Python
797,Useful resources to help you build your own Chatbot or Voicebot,learnmachinelearning
1202,"I created my first app, ""Timeglass"", a simple, unobtrusive menu bar timer for macOS.",Python
1095,Most important foundational papers in Computer Science,compsci
882,Narrowing down my college major. (Compsci/Physics),compsci
444,"Here is why to use NP.RESHAPE(-1,1) and what it do and in what various ways we can use it...",learnmachinelearning
1076,Is the syslog family suitable for logging in distributed systems?,compsci
364,One of the better LinkedIn post I have seen in a while,datascience
1182,[META] What has this subreddit turned into?,Python
181,Recommended software/cloud options for fitting algorithms on ~1.5 TB of data?,datascience
879,Proving P=NP is provable,compsci
441,Looks like my Python Environment after 1 year of coding,learnmachinelearning
370,Low key the new icon kinda sucks,datascience
890,The CAP Theorem,compsci
412,Machine Learning + Augmented Reality Project App Link and Github Code given in the comment,learnmachinelearning
1055,"With modern computers, can an automated system beat the best humans at chess? (please read details)",compsci
1430,Secrets of MicroPython 4: How to detect motion,Python
1391,Play Online Chess with Real Chessboard and Webcam,Python
634,Andrew Ng ML Course or Fast.ai ?,learnmachinelearning
722,Sparse datasets: Can I build models with incomplete data in multi variable linear regressions?,learnmachinelearning
155,Better Method to Predict Frequency/Timing of Payment,datascience
911,"Ask Compsci: Please help me detect BitTorrent shaping, details in comments",compsci
160,What is the highest job title you can attain in data science?,datascience
99,Data Scientist = Web Master from the 90s,datascience
401,Should Regression Analysis be included in Data Scientist's toolbox?,datascience
599,Does the negative of the gradient always go downhill?,learnmachinelearning
143,"Those of you who are taking Data Science courses at a university, what's the most memorable moment you've witnessed in a data science class?",datascience
645,"Use this new year to start learning something new! Whether it is machine learning or piano, just give it a try for 5 minutes tonight! If it is ML-related, this video might help out, and you can start there!",learnmachinelearning
93,Data is useless without labels. Compliments of XKCD - Thought you'd all appreciate this one,datascience
1148,Dramatically improve your skills with this simplified but more thorough guide on object-oriented programming in Python.,Python
154,Coding language for front end interface and user interaction?,datascience
1079,The Mozilla Common Voice project is building a free language database for machine learning to enable independent language technology. The final spurt for the next release of the data set is until July 20th.,compsci
1199,We did it,Python
404,"It's crazy how effective it's to include ""Data Scientist"" in your job listing.",datascience
149,"Which data science/ML development processes would you like to see more automated (i.e., have a Python library for)?",datascience
30,Should data scientists using R and Python switch over to Julia?,datascience
1512,"My trailer was stolen late last week, so I wrote a Craigslist scraper so I can see if anyone tries to sell it. (With repo link)",Python
489,Machine Learning Basics | Types | with Example in Hindi,learnmachinelearning
1317,YoutubeDownloader,Python
1500,"Pip Install Specific Version - Using Wheel File, Tar File-Most Important Video for Python Beginners",Python
1215,"The project is finally done, thanks a lot for all of the support you guys gave me. (Wireless media controller v1.2) #rifi",Python
891,Easiest way to start coding?,compsci
570,Beating FIFA using Logistic Regression,learnmachinelearning
1201,Happy 4th of July from Chicago,Python
1119,"Lad wrote a Python script to download Alexa voice recordings, he didn't expect this email.",Python
1334,Do you recommend the Google IT Automation with Python Professional Certificate @ coursera?,Python
1478,a new way to do documentation,Python
441,How It Feels to Learn Data Science in 2019 – Towards Data Science,learnmachinelearning
900,Internships??,compsci
1149,Python in a nutshell (Had to do it),Python
595,Intutive source for probability?,learnmachinelearning
1393,I wrote a script for Wordle,Python
1273,"Is Selenium my best option for logging into an account, retrieving data, and automating bill payment?",Python
874,HS Senior planning on pursuing a CS degree?,compsci
403,Is anyone else planning to stay at their current job just because of how demanding the interview process is?,datascience
1189,Why is P vs NP Important?,Python
1260,I made a temperature conversion tool with a fail-safe. Here's the code:,Python
62,Anyone in the transportation sector and working with data science ?,datascience
33,K-means be like: Mine ! MINE ! MINE !,datascience
705,"[ Question ] : Time Series Regression: Does modeling a monthly target variable using a couple quarterly (Q1, Q2, Q3, Q4) time series predictors along with monthly predictors violate any statistical assumptions? Would the beta coefficients make sense or are inferences void in this case?",learnmachinelearning
470,🔥 Machine Learning + JavaScript + TensorFlow = Superpower / Full Video Link in Comments (Via TensorFlow),learnmachinelearning
1544,How variables are saved in Python and Rust. Side by Side 3: bool,Python
488,Can graph machine learning identify hate speech in online social networks?,learnmachinelearning
1259,what should i do after learning fundamentals?,Python
1080,Top 5 Emerging AI Trends in 2021,compsci
828,"I'm a Senior DS and I put together a Youtube Channel with project tutorials, resume critiques, and career advice. Let me know what you think!",learnmachinelearning
184,Can I get away with using R Studio to run Python code only? Or will I have to eventually switch to a different platform?,datascience
1202,pound-python.org: #python HOWTO,Python
162,Classifying the Political Compass - what method?,datascience
1117,Is database knowledge actually one of THE core competencies for people working with data in any way?,compsci
811,Deeper Understanding of Machine Learning models,learnmachinelearning
1179,I made a Spotify ad stopper because I was too poor for Premium. It automatically detects when an ad plays and then restarts Spotify in the background. It's my first project after escaping tutorial hell and I'd love any feedback you guys have!,Python
1097,What are your thoughts on computer generated randomness.,compsci
1127,There is a flash of light! Your PYTHON has evolved into ...,Python
636,"RandomForestClassifier error: ValueError: X has 29 features, but RandomForestClassifier is expecting 950 features as input.",learnmachinelearning
1467,Best answer to what does yield do,Python
1161,TIL you can use a for...else construct in Python! I will certainly be using this henceforth.,Python
1205,White Cuts Across Black Background - an effect achieved through good use of the Python Image Library,Python
1142,Python Cheet Sheet for begineers,Python
1496,A password manager,Python
384,2nd Edition of ISLR is now available and free from the authors! It looks 1.5x bigger than the previous edition!,datascience
3,An r/datascience equivalent that's female-heavy,datascience
873,Doing 4 years of MIT CompSci in 12 months,compsci
908,The JavaScript epidemic,compsci
853,"New study shows high anguish and anxiety with computer tech support due to long lag times, lack of ready resolution",compsci
1178,Advantage of Python 3 (Functions and Variables),Python
834,How to Read Math as a Software Engineer,learnmachinelearning
421,A living legend.,learnmachinelearning
1070,How do yall take notes for class?,compsci
498,What is Machine Learning and what are its core concepts ?,learnmachinelearning
408,Is it common to find data scientist jobs that don't involve ETL?,datascience
1061,Someone please explain. How will an electron microscope gain access to encrypted data?,compsci
836,subwAI - I used a convolutional neural network to train an AI that plays Subway Surfers,learnmachinelearning
837,tensorflow v2.5 now natively supports GPU training on Apple M1. I did a quick performance comparison test with Apple M1 and Google Colab (Tesla T4). Please have a look at the article,learnmachinelearning
29,My tip to upcoming graduates who want to break into data science: don’t take your first job in something outside of data science,datascience
41,What is the difference between Data Scientist and Data Analyst?,datascience
390,I’m tired…,datascience
378,Do you think Data Science/BI data will be manipulated to serve politics and political objectives?,datascience
1180,"I was tired of opening 100s of tabs for internship apps. So, I made an app to scrape and apply to every single job listing on Glassdoor with one click using Selenium! (source code and YT video linked below)",Python
99,"Is this ""Data Science Technical Efforts Segmentation"" correct? Anything missed here?",datascience
471,Settled,learnmachinelearning
861,Who wants to help me solve a 17th century code?,compsci
1105,Are there story books/Novels revolving around computer science?,compsci
1430,Morse Code Translator Project and File Handling Project,Python
841,How can I improve the accuracy of my decision tree algorithm?,learnmachinelearning
819,Real-time recognition of handwritten math functions and drawing their graphs,learnmachinelearning
1413,Learn Python ASTs by building your own linter,Python
31,The formatting struggle.,datascience
1107,How is a bit saved in disk? What physics happen so that the 0 or 1 is stored?,compsci
872,Found this while reading SICP from MIT.,compsci
862,I'm interviewing for an internship at a large social networking company what sort of interview questions should I expect.,compsci
200,The PyMC devs have made their book available free online!,datascience
615,StarCraft 2 Python AI - Build Marines as a Terran,learnmachinelearning
887,"Programming is a skill, not a profession.",compsci
1523,I wrote another Binance trading algo in Python. This one is able to analyse how volatile every coin on Binance is and place a trade when during a strong bullish movement,Python
380,Partner for data science consultancy firm,datascience
576,💊Your daily dose of machine learning : different types of GANs,learnmachinelearning
487,Siraj Raval has a new paper: 'The Neural Qubit'. It's plagiarised,learnmachinelearning
497,GANsResearch - A Subraddit to have discussions on Generative Adversarial Networks.,learnmachinelearning
60,Florida Data Scientist Fired/Arrested,datascience
906,Dynamic Host Configuration Protocol (DHCP)/Domain Name System (DNS),compsci
1488,16 bytes of Python code compiles to 32 terabytes of bytecode,Python
1434,I created a game bot that plays a game for me and collects rewards.,Python
918,"ArtLine, Deep Learning model to generate Line Art Portraits. GitHub link in comments",compsci
1537,"Guido van Rossum ""honored"" as Python becomes #1 most popular programming language on TIOBE ranking, passing C and Java",Python
1493,Malicious Webpage Classifier using DNN [Pytorch],Python
915,6th grade me solved P=NP… i don’t know how y’all didn’t think of this 😌😌😌,compsci
1498,Kivy App Full Tutorial - (Part 1) | Debug Mode | kivy android apk | kivy android app tutorial 2021,Python
887,A full adder using dominoes,compsci
1536,Is it possible to be a Python developer?,Python
834,"Hi. I am 15 year old programmer and started my own ML course. In case you are interested show some support, love you all :) #MachineLearningForBeginners",learnmachinelearning
1040,Exploring Application Layer Protocol Negotiation (ALPN),compsci
45,We've all been there.,datascience
1486,Do not use mutable objects as default arguments in Python,Python
1069,"« Words in a Day » This project was made for a four-days workshop on data visualization in relation to the idea of ""quantified self"" (See link in Comment for more) IUAV University of Venice",compsci
208,What kind of analysis I should conduct to see impact from multivariate time-series data?,datascience
1255,NASA Scientists use Jupyter to visualize the atmosphere of planets,Python
385,LinkedIn / Blind / This sub is not real life,datascience
1428,What is a normal pylint score and what is its significance?,Python
1058,Programmer calculator and LL parser made in C from scratch,compsci
1101,How important is calculus for what you do?,compsci
791,"A set of Jupyter Notebooks to help you understand ML algorithms of regression, dimensionality reduction, unsupervised clustering, KNN, neural networks, etc.",learnmachinelearning
1539,"I am 14 years old, please rate my work!",Python
433,A great video to teach you how to build an AI startup!,learnmachinelearning
1335,[D] Hear me out: I found a better way to estimate the median,Python
918,Outperforming Rust With Functional Programming,compsci
949,"My 2020 curated list of articles, resources and links on programming, math and computer science.",compsci
845,*Semantic* Video Search with OpenAI’s CLIP Neural Network (link in comments),learnmachinelearning
948,P vs NP explained using only loops,compsci
809,accuracy,learnmachinelearning
698,NADAM Optimizer from Scratch in Python,learnmachinelearning
1131,I've designed brand new cheatsheets (x2) and handouts (x3) for matplotlib,Python
907,are non-square circuits on the edge of wafers used for anything?,compsci
1520,Python for Cybersecurity,Python
1172,Replicating Face Mask Detection - OpenCV and MobileNetV2,Python
205,Do you use your numpad on your keyboard for data science related projects?,datascience
1091,Can CSE graduates do a masters in computational physics in India?,compsci
361,Skew you!!!,datascience
727,Help me understand and answer a quiz question.,learnmachinelearning
911,Tim Berner Lees anouncment of the world wide web (Last paragraph),compsci
73,Don't be this guy. (x-post from r/programmerhumor),datascience
1180,Photoshop'd parentheses on my background to match Python3,Python
1079,BSC Numerus fixus Computing Science,compsci
633,help understanding ppo algorithm,learnmachinelearning
463,Real Life MARIO ... my 4hrs of work,learnmachinelearning
1542,Learning Python without writing code all the time,Python
1291,nurses_2: Widget and async-centric terminal graphics library.,Python
16,"This corona thing is pretty lame, but this is America. I want to help out, but not by doing pseudoscience with no understanding of epidemiology. Maybe I could help manufacturers of related medical materials or help with logistics/planning, etc. using big data. Any ideas?",datascience
410,Everything wrong with Zindi data science competition platform.,datascience
449,I am compiling a list of technical skills that a successful Data Scientist must have. Feel free to add on.,learnmachinelearning
605,Deriving Taylor Series for Deep Learning Activation Functions,learnmachinelearning
1541,I never knew events were THIS powerful - A Python observer pattern tutorial,Python
209,Jupyter Notebook not giving any output?,datascience
1340,"GitHub - rodrigo-arenas/Sklearn-genetic-opt: Hyperparameters tuning and feature selection, using evolutionary algorithms.",Python
1090,The Cursed Computer Iceberg 🧊,compsci
1268,Hack Web Views With A Selenium Python Bot,Python
1372,featureclass - new way to organize your feature engineering code,Python
1415,br4nch 1.1.2 - Data Structure Tree Builder for Python.,Python
1508,Would y’all be interested in a Python YouTuber that’s a fresh beginner?,Python
182,Helping Business Analysts Understand Data Science and Machine Learning,datascience
798,What is the need for the learning rate in gradient descent?,learnmachinelearning
153,"Free reliable, global, easily update-able data",datascience
701,Inductive Bias of Deep Models,learnmachinelearning
1308,Moving from pipenv to poetry or PDM,Python
183,From Data Science to Software Engineer (SWE),datascience
146,"Trying to get into data science, degree paths and certifications seem confusing.",datascience
1334,Why you should code Battleship after Tic Tac Toe!,Python
616,My Top 10 Computer Vision papers of 2021,learnmachinelearning
1276,Django wants you to build poor quality apps. Here's how to fix this.,Python
1211,Ruby vs Python,Python
588,Google Colab's TPUs are training my fashion_mnist model about 5-6 times SLOWER than on CPU. Is there a reason for this and is there a way to make it run faster? Any and all help is appreciated. Thanks.,learnmachinelearning
721,"Why is this tensor size <length, 1, num_letters> necessary?",learnmachinelearning
848,Backpropagation Algorithm In 90 Seconds,learnmachinelearning
1263,Solving software engineering interviews like an expert in Python,Python
1545,Let's Learn Python - Lists,Python
704,10 Best AI Courses: Beginner to Advanced,learnmachinelearning
1207,Lil cheatsheet,Python
393,Data quality assessment tool,datascience
1504,Python running without an OS!,Python
1171,Practical threaded programming with Python,Python
598,What are Graph Neural Networks?,learnmachinelearning
864,I taught a neural network to play Flappy Bird with Java/Kotlin,compsci
865,This guy's art is super cool and I immediately thought it would make an interesting algorithm! Does anyone think they're up to designing one?,compsci
686,How to get Training Data,learnmachinelearning
1514,10+ Year CS Teacher here. What I'm doing and why I'm doing it,Python
1492,Am I wasting my time?,Python
58,Useless tutorials and blog post will NOT improve your CV but WILL waste our time,datascience
1136,I made a little program that mutes spotify ads because i dont have the money to get premium . Not anything special but i think its quite neat. Any ideas on cool python projects i can build ?,Python
1061,Medical Imaging Classification,compsci
1387,Is it really so important to have experience of working in big (5-10 people) developer teams?,Python
855,[Project] From books to presentations in 10s with AR + ML,compsci
81,Christmas gift from girlfriend. Can't wait to read all. Hope everyone here had a blessed holiday season!,datascience
1053,I used a Genetic Algorithm to generate Cellular Automata.,compsci
491,The only reason I want to further my learning in Machine Learning,learnmachinelearning
1049,Qualification Scenarios in a Tournament,compsci
1530,What are the key reasons Python became so popular?,Python
1190,My pothole detector. Used yolov3 annotated images on labelimg.,Python
484,Second ML experiment feeding abstract art,learnmachinelearning
66,Alternative Python Module to Pandas,datascience
1182,Found this on twitter,Python
818,Remove your Tattoos Using Deep Learning / Code Link is given in the comment,learnmachinelearning
