,text,label
18,The next time my coworkers ask what metrics I used for my model.,datascience
1536,So I like to eat and I like to code but I dont like full priced items - I built a tool to find all sales at various groceries every day so I know how to plan my meals! Take a look - its open source!,Python
1112,Denigma is an AI that explains code in understandable English. Test it for yourself and tell me what you think,compsci
221,How to transition to manager,datascience
15,Brutal Honesty - No Naivety,datascience
1213,xkcd: Python Environment,Python
944,Would you consider Computer Science really a science?,compsci
79,"As data scientists, does anyone else despise PowerPoint?",datascience
642,Mastering Machine Learning,learnmachinelearning
1106,Program for sine waves,compsci
598,Should we drop the AI when referring to AI/ML?,learnmachinelearning
1277,Pyspark now provides a native Pandas API,Python
1540,THAT'S IT! I'M CONVERTING,Python
24,Provocative question: is there a version of R that isn't broken?,datascience
82,Thought y’all could appreciate this as well.,datascience
939,"Does it annoy anyone else that compsci's reddit alien is saying, ""P=NP""? ",compsci
1092,What is your favorite computer science podcast?,compsci
71,I did it!! Now I need some resume critique,datascience
1052,The future OS kernel will be a data-oriented scheduler (with Computer hardware and software integration architecture diagram),compsci
1343,Storing Selenium Scraper Progress,Python
1513,"Hey i made a currency converter . You can convert any currency and even value of gold per gram to U.S Dollars . I have added a handful of currencies in this program , so yea also this is my first post here as i just joined . This is Python CUI as i dont know GUI.",Python
67,3rd year data scientist w/ PhD: Any advice for my resume?,datascience
812,Numpy with Python Tutorial for Beginners | Linear System with Numpy in Python,learnmachinelearning
1289,Data Engineering in Python,Python
27,Found this,datascience
420,Why you should use Sublime Text for Data Science,learnmachinelearning
78,Data science 2.0.,datascience
506,What English words are most common in K-pop songs? (Standford NLP & WordCloud),learnmachinelearning
1339,Python Project : JARVIS Ai Voice Assistant (2022),Python
1331,Variables in Python - Lecture 2 | Python Course for Beginners,Python
1468,QR Code In 4 lines of Python Code (Create / Read),Python
1179,5 Reasons why Python is Powerful Enough for Google,Python
798,Successfully wrote my first back-propagation algorithm!,learnmachinelearning
1382,How to predict the future using python,Python
1517,Python finally has a Switch Case,Python
937,More than a Million Pro-Repeal Net Neutrality Comments were Likely Faked,compsci
802,Fix for Kaggle interface error,learnmachinelearning
496,Career in Machine Learning,learnmachinelearning
161,"Project, Tried 6/7 models, all give bad accuracy.",datascience
14,When the boss doesn’t like your charts,datascience
1503,Interesting Article: Is Programming Good for Kids,Python
630,What is L1 distance? A 2-minute visual guide.,learnmachinelearning
593,🧠 A Neural Network Solves and Generates Mathematics Problems by Program Synthesis 🧠 | Paper Explained,learnmachinelearning
1160,How to get banned from PyCon,Python
1405,Uber Releases V1.1 of Orbit: A Python Package to Perform Bayesian Time-Series Analysis and Forecasting,Python
931,"A single-cycle ARMV7 processor that I designed from scratch looking at the arm instruction set for a course. Main board, control unit, main decoder, register file, and ALU in order.",compsci
1515,Python passwords manager and generator,Python
1030,"If You're Not Writing a Program, Don't Use a Programming Language (2018) [pdf]",compsci
1507,"I Started Learning Python Almost 3 Days Ago, And This Is My First Script Ever. How Is It?",Python
363,"FYI: If You're New to the Industry, the Data Science Job Market is Saturated",datascience
33,Party's Over?,datascience
647,Do I need any background deegre for ML?,learnmachinelearning
166,How was your graduation project ?,datascience
1157,Made an annoying Python script that sends a friend on Facebook Messenger the Shrek movie word by word,Python
1186,I'm Pickled Rick!!!,Python
862,Some more fun with recursive image transformations. Flips and rotations! Source code in comments!,compsci
1046,Why can't step over after scanf? [already input and hit enter],compsci
87,Experience/Advice from a 10+ year data scientist,datascience
1513,The Self-Taught Programmer (For Python) Udemy Course is Free (I think only for today),Python
583,"After Python and R, which of the following language is most worthwhile to learn for ML?",learnmachinelearning
883,YAWYSIWYGEE: Yet another what-you-see-is-what-you-get equation editor,compsci
384,Always Create Three Resumes for Data Science Jobs,datascience
849,Is there a forum where I can show my data and get recommendations on which algorithm to use and how to create model around the data?,learnmachinelearning
1135,Apparently Quentin Tarantino is making a movie about Python web programming ,Python
825,How Computers Have Already Surpassed The Human Brain,learnmachinelearning
509,"I’m a Data Scientist, Not The Little Tiny Hands that Crunch your Data",learnmachinelearning
644,Cannot install PyCaret :(,learnmachinelearning
1495,"Python programming: We want to make the language twice as fast, says its creator",Python
1191,I made a fractal tree in python using turtle,Python
594,How to Learn Mechine Learning as a Beginner?,learnmachinelearning
460,Reinforcement Learning for you,learnmachinelearning
1410,"Updating Pants BUILD files programmatically, using Bazel tooling",Python
931,Was Alan Turing wrong ? Jeff Hawkins thinks so...,compsci
687,How to get good at Data Preprocessing/Feature Engineering?,learnmachinelearning
1100,Podcast about computer science or topics related ?,compsci
34,"Key differences between Artificial intelligence, Data Science, Machine Learning and Big Data",datascience
398,What management want me to do,datascience
135,"I started self learning data science 2 years ago, and this where I’ve gotten. Advice for beginners.",datascience
1332,✔ 2022 Python Programming (Beginner To Advanced),Python
5,Learning data science as if you're an anime protagonist,datascience
1327,tplot: a library to create text-based plots in the terminal,Python
855,"No Girls, Blacks, or Hispanics Take AP Computer Science Exam in Some States",compsci
603,Any resources to improve coding in ML/AI?,learnmachinelearning
1452,"My startup failed, so I open sourced the code. I hope someone finds it useful.",Python
1426,Towers of Hanoi,Python
1391,Ever wonder's this.py module looks?,Python
34,Data Scientists on languages...,datascience
454,"As one of my first projects, I made a web app that recognises the math symbol that was drawn and converts it into unicode!",learnmachinelearning
1532,I created a planet weight calculator whit python,Python
1413,Small library to parse UK postcodes,Python
478,"FYI: If you've had your eye on Andrew Ng's ML Coursera course, but are turned off by Matlab/Octave, there is a repo of all the exercises written for Python/Jupyter",learnmachinelearning
164,How do you reduce information leakage and bias when going from descriptive analytics to prescriptive analytics?,datascience
800,Jarvis - Speech Recognition Demo with ML5 js,learnmachinelearning
1140,[TIL] CPython is mostly written in Python (not C),Python
817,Few-Shot Patch-Based Training (Siggraph 2020) - Dr. Ondřej Texler - Link to free zoom lecture by the author in comments,learnmachinelearning
1111,Intel Optimizes Facebook DLRM with 8x speedup (Deep Learning Recommendation Model),compsci
1158,I'm developing a game with Python and Pygame!,Python
356,Has anyone ever worked with data so difficult that no statistical model was able to make sense of it?,datascience
65,Does Alteryx has future...?,datascience
629,Practising ML,learnmachinelearning
363,Why should I join the company?,datascience
1215,Intro to Numpy,Python
816,I created an emoji search tool using word embeddings,learnmachinelearning
790,Landing a Data Job (Free DS course),learnmachinelearning
1475,I wrote a song about everyone's favorite Python Enhancement Proposal,Python
1322,Lambda List bug,Python
1281,Web api benchmarking: Python (Flask (prod setup)) vs Rust (actix-web),Python
18,Rookies.....,datascience
1077,Minimal implementation of SSD: Single Shot MultiBox Detector,compsci
72,I THINK Data Science is right for me...but I'm not sure. Any suggestions?,datascience
1210,What is Redis?,Python
689,Checking and questioning my knowledge of a ANN,learnmachinelearning
15,"For any python & pandas users out there, here's a free tool to visualize your dataframes",datascience
1313,Virtual PDF Library,Python
868,Opinion: CS in Universities Should Not Belong to Arts and Sciences,compsci
53,Deepnote: The Google Sheets of Jupyter notebooks,datascience
1122,Why Python is Powerful Enough for Google,Python
163,What tools do data scientists use to manage their time?,datascience
1105,Confused about the utility of router(host) loopback address other than for testing purposes,compsci
852,Logic gates using liquids,compsci
736,Error while comparing SGD+momentum to SGD,learnmachinelearning
936,The Black Hole Photo is the result of a gigantic engineering project in which numerous telescopes around the world were synchronized using atomic clocks so accurate that they lose just one second per hundred million years,compsci
135,Research Project - Showing Causality in Non-Linear Data,datascience
792,Need help making a transformer model and alterations to make to it.,learnmachinelearning
1499,Setup VScode For python scripts | Minimal Setup for absolute beginners,Python
579,The ML Dojo -- get daily updates on the latest in the field of Artificial Intelligence 🧠 and Machine Learning 🤖,learnmachinelearning
344,Any Master program that easy to get in?,datascience
1106,Secure voting systems,compsci
465,All Stanford AI courses (100% free!),learnmachinelearning
1485,PyCon US 2021 Notes,Python
577,Any self-taught ML engineers from a NON-CS background?,learnmachinelearning
1067,(Form) Do you have any discomfort when using the computer?,compsci
858,/r/theoreticalcs - a subreddit for theoretical Computer Science,compsci
1345,Finally published my first python package!!,Python
583,MIT's opencourseware ML courses,learnmachinelearning
212,No prediction can be 100% accurate.,datascience
152,Maybe someone looking for a data science job in soccer - AS Roma is looking for a Data Analytics Manager,datascience
1183,6 Experts share amazing ways a beginner can learn Python programming.,Python
506,Let’s go!,learnmachinelearning
1137,Python Programming Tutorial File handling part 18,Python
1531,A horrifying single line neural network using NumPy,Python
1386,pyQuickie API! make your own leetcode or other similar website,Python
1283,How did you learn python?,Python
1304,br4nch: Data structure tree generator for Python,Python
1500,A post of appreciation of development of Python,Python
870,Ever wonder how rendering works from your perspective?,compsci
1051,How to unzip password protected zip file without password???,compsci
1305,Detect stock patterns from images,Python
871,I think I'm going insane.  And I hate fortran. Anyone have any clue why some code would be doing this?,compsci
638,Smooth loss,learnmachinelearning
643,Introduction to Machine Learning for beginners.,learnmachinelearning
421,5 Surprising Ways Machine Learning is Being Used Today,learnmachinelearning
634,[D]You're working against a tight deadline and need to deliver a project quickly. Would you consider speeding up your model training by using only a subset of the available training data?,learnmachinelearning
1150,Python 3.2.2 released!,Python
1141,[Beginner’s Guide] How to start programming in Python,Python
1274,Created a Stack overflow clone with almost every functionality,Python
933,"For any python/pandas users I've been building this visualizer for dataframes for the last year, let me know what you think",compsci
1074,"Get code for ML/AI papers anywhere on the internet (Google, Arxiv, Twitter, Scholar, and other sites)! ❤️",compsci
566,Learning Machine Learning Efficiently,learnmachinelearning
811,Learning Roadmap for Beginners in ML (I'm following it). What do you guys think about it?,learnmachinelearning
1401,Expert Data Science Blueprint | The Secret behind Successful Data Scientist | Part 1 (of 15) | 12 hours full Data Science with Python course | Links to resources in comments,Python
1324,spotify >> mp3,Python
393,How do you motivate yourself to pursue your own projects in your free time when working full-time?,datascience
1045,"Would a ram only computer be super fast but expensive? Is it possible, or practical in any way?",compsci
86,SQL IRL,datascience
687,Career advice : phd or not or what would you do,learnmachinelearning
1177,Some neat tricks for concise Python,Python
1280,Fixing Memory Leaks In Popular Python Libraries,Python
1505,Elegant One-Liners in Python,Python
643,How to specify which nodes in the feature map get applied with different filters/layers in Tensorflow,learnmachinelearning
737,Another thirty days of machine learning with Kaggle (Part 1),learnmachinelearning
25,Expectation vs reality,datascience
203,Friendly reminder to just go ahead and set up git on everything,datascience
1123,Do the moderators here actually do anything or are they just for show?,Python
219,ML/AI freelancer ?,datascience
1508,Free Python Learning Resource Provided by Microsoft,Python
559,A while ago I created a data science trivia game. I collected more than 170 Q&A. I usually sell them but if there is any student here that wants a digital deck I'm happy to give it for free. The questions are great for interviews.,learnmachinelearning
1477,👀 Chem.py has started development 🎉 A python library for doing chemistry simulations!! It's open-source too!!!!,Python
188,How do you feel about libraries that build models for you in R/Python?,datascience
1072,Emulating a CPU in software (plus a basic assembler),compsci
400,Completed 48hr take home assessment over the weekend. Rejected top of the morning on Monday.,datascience
1337,Working with JWTs in Python,Python
1310,Create Your First Reddit Bot with Python and Heroku,Python
1375,Web Development in Python - Flask vs Django,Python
1056,"It's Alan Turing's Birthday on the 23rd of June, who wants to send flowers?",compsci
1086,"I made a YouTube series on a very interesting coding competition called the ""C Bignum Bakeoff"" held in 2001. Participants write a short C program and the biggest output wins. Going through the entries, one hits upon a lot of fun compsci topics; the link is in the post, along with a few more details.",compsci
1157,Python Creator Guido van Rossum Reviews Code on CheckiO,Python
1028,"APL ∊ BCN (Barcelona, Spain)",compsci
172,"The more I think of my data career, the more anxious I become (mid career)",datascience
878,Hey reddit. How do you choose your passwords?,compsci
385,Working at a job with poor data,datascience
361,Does anyone know of any “Day in a Life of a Data Scientist” video of someone that has ADHD?,datascience
438,How Machines Learn - CGP Grey,learnmachinelearning
1186,Hexapod Robot Simulator with only Numpy and Plotly Dash,Python
375,I'm a Senior Data Scientist at Disney and I'm hosting another Data Science Q&A session this Thursday @ 5:30 PM PST. I'll be joined by a Principal Data Scientist at Clearbanc!,datascience
917,"A python bot that attends your online classes for you and marks your attendance while answering in class using Speech recognition, Image processing and a bit of NLP.",compsci
1485,People using Ternary expressions.....who hurt you?,Python
1479,SQLLEX | Better than sqlite3,Python
1295,The hand-picked selection of the best Python libraries released in 2021,Python
1194,Snake 4d - 4 spatial dimension game,Python
1152,End-to-End Self Driving Car - Need For Speed,Python
407,Networking - it's not just LinkedIn connections,datascience
199,Could/should Javascript have been the defacto DS language?,datascience
4,Self Taught Data Scientist Looking to Mentor 3 Aspiring Data Scientists,datascience
510,Domain - business area,learnmachinelearning
808,GOOGLE COLAB PRO,learnmachinelearning
647,Model consistently under forecasting,learnmachinelearning
617,Infinite Anime Faces Straight to a Web App,learnmachinelearning
896,I wish my OS textbook was like this,compsci
382,Introduction to Data Science book updated,datascience
507,A Machine Learning victim,learnmachinelearning
397,Just recently turned in my two weeks notice as an analyst,datascience
1318,I made a Fasting Calculator with python!,Python
196,Is data structures and algorithms worth spending my time on before I start my job?,datascience
387,Resume observation from a hiring manager,datascience
212,Is it possible to combine Data Science with hacking / IT-security?,datascience
642,Project: Detecting Pneumonia using Deep Neural Networks.,learnmachinelearning
90,It's like the notebook but with more tears,datascience
1129,Just trying to create a orbit system in python and this happened...,Python
1366,12 Best Completely Free SQL Online Courses,Python
866,I'm going into compsci as a college freshman in the fall. This is my senior English Final.,compsci
1173,I think it’s clear why I chose a Software Engineering career path instead of being an Artist,Python
148,What are the reasons a machine learning/QSAR model might fail?,datascience
1427,Django Consistency Model,Python
1257,'Tis the season of giving: Learn Python regex with free ebook and 75 interactive exercises,Python
389,Webinar: How to start a data consulting business,datascience
875,Could a newborn baby walk and run by wearing a powered exoskeleton with real-time brain scanner?,compsci
35,"A ""Data Science"" company stole my gf's ML project and reposted it as their own. What do I do?",datascience
1285,Learn and create modules in Python in 8 minutes,Python
1124,100 Data Science in Python Interview Questions and Answers,Python
631,Theory vs Experimental Research within the field of ML and AI,learnmachinelearning
1197,Been learning Python as my first language for about two weeks now. Wanted to show off my first couple simple programs. ,Python
1253,"Guido van Rossum - Python 4.0 will never arrive🤚😔: ""Thеrе will probably nеvеr bе a 4.0 and wе’ll continuе until 3.33, at lеast."" - Sabrina Carpenter [Medium] Then, evidently, we will get a Python 'Pi'",Python
1118,What makes a minimum spanning tree unique?,compsci
1341,Mechanical/Industrial/Aerospace python projects to colab in,Python
671,Time Series Classification Tutorial: Combining Static and Sequential Feature Modeling using Recurrent Neural Networks (Use Case: Cardiac Arrest),learnmachinelearning
1123,"Just finished programming and building my own smart mirror in python, wrote all of the code myself and implemented my own voice control and facial recognition features",Python
1457,Any love for Python 2.5 on an i486?,Python
1136,Python 3 Wall of Shame,Python
1062,How do you think should Calculus be taught to Computer Scientists?,compsci
1411,My python template repository,Python
468,Become a Data Scientist in 2020 with these 10 resources,learnmachinelearning
909,I used some Java Swing to visualize a neural network's output,compsci
405,"New Job: No training, too busy to help you, we don't have documentation, we want AI and Machine Learning applied wherever I say so (even if we don't know what that means)",datascience
145,Excel pivot table for 100k rows?,datascience
947,Programming Books for Professionals. All the available books are free of cost and legit.,compsci
6,True that,datascience
1110,The Duties of John von Neumann’s Assistant in the 1930s,compsci
1134,Stop writing lambda expressions in Python,Python
822,precision vs recall: know the difference,learnmachinelearning
1115,"If P=NP, what would mean for non-researchers and academic folks? How would change, if any at all, the way we write softwares?",compsci
1158,Pillars of Python: Six Python Web frameworks compared,Python
406,"As a beginner in this field, Is it normal to feel insecure after seeing people showing crazy ML projects on linkedin?",datascience
1535,coin flipping python game,Python
1280,"Do you know, starting from Python 3.10, we can implement Switch-Case statement in very easy way?",Python
360,1st Attempt: Algorithm Selection Flowchart,datascience
1059,Humans Can't Be the Sole Keepers of Scientific Knowledge,compsci
1096,New Proof Reveals That Graphs With No Pentagons Are Fundamentally Different,compsci
1147,Creating python command-line applications,Python
588,How to come up with a novel NLP project?,learnmachinelearning
1159,A DoS attack in 15 lines of code.,Python
1435,I finished Minesweeper!,Python
913,Minesweeper is (probably) not NP,compsci
924,"They said I couldn't have a ham, tomato and cheese croissant; I say they need to review their logic statements",compsci
457,What do you guys think of Siraj Raval's new Data Lit course?,learnmachinelearning
74,"My friend said data scientists will be dead soon due to data ""robot""?",datascience
1073,Concept idea I had: a processor with only a NAND gate.,compsci
1293,"So, I made this Python algorithm to measure the user's heart-beat just with a video of his finger",Python
1212,"Started learning python today, Screw 'Hello World' , I'll start with 'Hello There'",Python
1299,Should I create another python course,Python
373,Tidyverse appreciation thread,datascience
389,"R, I love you.",datascience
1181,Change text in place with custom hotkeys (Python Keyboard Listener),Python
821,"What Algorithm should i use for my Problem, help",learnmachinelearning
160,Is this subreddit for data analysts or just data scientists?,datascience
178,"Fellow WFH’ers, how many hours a week do you think you actually work",datascience
63,Poor little data analysts,datascience
1459,i made a bot that turns reddit arguments into ace attorney,Python
1510,A short list of patterns that beginners miss while writing Python.,Python
1524,"Complete Python Course (~5 Hours, Free)",Python
375,"If DS is becoming more like SWE everyday, what is going to happen to the DS that are more like statisticians, predictors, forecasters?",datascience
1195,[nsfw] script-alize every ***king thing in life e.g. texting to wife etc.,Python
1150,I wrote a Python program to play Google Dinosaur Game using Gesture Recognition,Python
1188,15 Essential Python Interview Questions,Python
1082,Columbia's Alfred Aho and Stanford's Jeffrey Ullman receive 2020 ACM A.M. Turing Award,compsci
646,"Bootcamp Graduation Project, generating new cooking recipes from a list of ingredients. Which models could fit the task ?",learnmachinelearning
1092,Questionable New Website: Omicron.life,compsci
1093,First all-atom simulation of respiratory aerosol with COVID-19 virus inside!!,compsci
149,I'm beginning to think that the data science job I want doesn't actually exist,datascience
5,Imposter Syndrome is a problem for me and I think this is the main contributor,datascience
1497,I'm giving away my book on writing beautiful Python for free to celebrate its alpha release,Python
452,I made an Infographic to summarise K-means clustering in simple english. Let me know what you think!,learnmachinelearning
1543,"A free HTML version of my book ""Python from the Very Beginning""",Python
1064,Is anyone else still in awe of coding/programming and what all it can accomplish?,compsci
509,"People write poetry when they feel creative. I'm writing a book titled ""Implementation of Machine and Deep Learning Algorithms in Python with Mathematical Context"". Minimal library use, 100% pythonic implementations for machine learning and state-of-art implementations using TF for deep. free+donate",learnmachinelearning
1156,This great message,Python
439,This is a project to create artificial painting. The first steps look good. I use tensorflow and Python.,learnmachinelearning
635,Fast AI NLP course vs Standford 's Natural Language Understanding course,learnmachinelearning
947,"A demonstration of how bad computers are at picking random numbers - each pixel is a random colour, with the random function seeded with the pixels x and y coordinates multiplied together before drawing each pixel. A pattern clearly emerges (other than the trivial diagonal line of symmetry)",compsci
1310,Rate my python calculator!! (new to python),Python
383,"How many of you are hybrids of data analyst, data scientist, and data engineer?",datascience
1184,Randomly Generate 69420 - Generate random 5-digit numbers until 69420 is generated,Python
181,Interesting 2021 paper roundup from a CMU econ prof. Lots on forecasting!,datascience
606,[P] Generating iPhone13 mini cases using StyleGAN2-ADA,learnmachinelearning
1185,Fourier Series Visualizer in pygame.,Python
1467,MIT offers free online course in Computer Programming using Python,Python
1125,Drawing Mona Lisa with 256 circles using evolution [Github repo in comments],Python
204,Can I use standard deviation to turn a predicted value into a range?,datascience
819,Build a Machine Learning Model in Under 10 Minutes in the Browser (Dance Move Pose Detector),learnmachinelearning
180,"The PyMC developers wrote a book! "" Bayesian Modeling and Computation in Python"" Detailed ToC screenshotted, link to publisher's page in first photo",datascience
1538,Ladies and gentlemen - switch cases are coming!,Python
1315,TDD Approach to Create an Authentication System With FastAPI Part 3: Mocking and Dependency Injection,Python
